<?xml version="1.0" encoding="UTF-8" standalone="yes"?>
<KitData xmlns:xsi="http://www.w3.org/2001/XMLSchema-instance" xsi:noNamespaceSchemaLocation="ILSAndLadderInfo.xsd">
  <Version>2.7</Version>
  <LaneStandards>
    <ILS>
      <ILSName>ABI-ROX-500</ILSName>
      <DyeName>ROX</DyeName>
      <LaneStandard>
        <Name>ABI-ROX500</Name>
        <DisplayName>75-500</DisplayName>
        <Characteristics>75 100 139 150 160 200 250 300 340 350 400 450 490 500</Characteristics>
        <RelativeHeights>MH MH MH MH MH MH MH MH MH MH MH MH MH MH</RelativeHeights>
        <CorrelationAcceptanceThreshold>0.993</CorrelationAcceptanceThreshold>       
        <CorrelationAutoAcceptanceThreshold>0.9975</CorrelationAutoAcceptanceThreshold>
      </LaneStandard>
      <LaneStandard>
        <Name>ABI-ROX450</Name>
        <DisplayName>75-450</DisplayName>
        <Characteristics>75 100 139 150 160 200 250 300 340 350 400 450</Characteristics>
        <RelativeHeights>MH MH MH MH MH MH MH MH MH MH MH MH</RelativeHeights>
        <CorrelationAcceptanceThreshold>0.993</CorrelationAcceptanceThreshold>
        <CorrelationAutoAcceptanceThreshold>0.9975</CorrelationAutoAcceptanceThreshold>
      </LaneStandard>
      <LaneStandard>
        <Name>ABI-ROX400</Name>
        <DisplayName>75-400</DisplayName>
        <Characteristics>75 100 139 150 160 200 250 300 340 350 400</Characteristics>
        <RelativeHeights>MH MH MH MH MH MH MH MH MH MH MH</RelativeHeights>
        <CorrelationAcceptanceThreshold>0.993</CorrelationAcceptanceThreshold>
        <CorrelationAutoAcceptanceThreshold>0.9975</CorrelationAutoAcceptanceThreshold>
      </LaneStandard>
      <LaneStandard>
        <Name>ABI-ROX350</Name>
        <DisplayName>75-350</DisplayName>
        <Characteristics>75 100 139 150 160 200 250 300 340 350</Characteristics>
        <RelativeHeights>MH MH MH MH MH MH MH MH MH MH</RelativeHeights>
        <CorrelationAcceptanceThreshold>0.993</CorrelationAcceptanceThreshold>
        <CorrelationAutoAcceptanceThreshold>0.9975</CorrelationAutoAcceptanceThreshold>
      </LaneStandard>
      <LaneStandard>
        <Name>ABI-ROX100-500</Name>
        <DisplayName>100-500</DisplayName>
        <Characteristics>100 139 150 160 200 250 300 340 350 400 450 490 500</Characteristics>
        <RelativeHeights>MH MH MH MH MH MH MH MH MH MH MH MH MH</RelativeHeights>
        <CorrelationAcceptanceThreshold>0.993</CorrelationAcceptanceThreshold>
        <CorrelationAutoAcceptanceThreshold>0.9975</CorrelationAutoAcceptanceThreshold>
      </LaneStandard>
      <LaneStandard>
        <Name>ABI-ROX100-400</Name>
        <DisplayName>100-400</DisplayName>
        <Characteristics>100 139 150 160 200 250 300 340 350 400</Characteristics>
        <RelativeHeights>MH MH MH MH MH MH MH MH MH MH</RelativeHeights>
        <CorrelationAcceptanceThreshold>0.993</CorrelationAcceptanceThreshold>
        <CorrelationAutoAcceptanceThreshold>0.9975</CorrelationAutoAcceptanceThreshold>
      </LaneStandard>
    </ILS>
    <ILS>
      <ILSName>ABI-LIZ-500</ILSName>
      <DyeName>LIZ</DyeName>
      <SubFamily>
        <SubFamilyName>ABI-LIZ-500-MID-INTACT</SubFamilyName>
        <LaneStandard>
          <Name>ABI-LIZ500</Name>
          <DisplayName>75-500</DisplayName>
          <Characteristics>75 100 139 150 160 200 250 300 340 350 400 450 490 500</Characteristics>
          <RelativeHeights>MH MH MH MH MH MH MH MH MH MH MH MH MH MH</RelativeHeights>
          <CorrelationAcceptanceThreshold>0.993</CorrelationAcceptanceThreshold>
          <CorrelationAutoAcceptanceThreshold>0.9975</CorrelationAutoAcceptanceThreshold>
        </LaneStandard>
        <LaneStandard>
          <Name>ABI-LIZ450</Name>
          <DisplayName>75-450</DisplayName>
          <Characteristics>75 100 139 150 160 200 250 300 340 350 400 450</Characteristics>
          <RelativeHeights>MH MH MH MH MH MH MH MH MH MH MH MH</RelativeHeights>
          <CorrelationAcceptanceThreshold>0.993</CorrelationAcceptanceThreshold>
          <CorrelationAutoAcceptanceThreshold>0.9975</CorrelationAutoAcceptanceThreshold>
        </LaneStandard>
        <LaneStandard>
          <Name>ABI-LIZ400</Name>
          <DisplayName>75-400</DisplayName>
          <Characteristics>75 100 139 150 160 200 250 300 340 350 400</Characteristics>
          <RelativeHeights>MH MH MH MH MH MH MH MH MH MH MH</RelativeHeights>
          <CorrelationAcceptanceThreshold>0.993</CorrelationAcceptanceThreshold>
          <CorrelationAutoAcceptanceThreshold>0.9975</CorrelationAutoAcceptanceThreshold>
        </LaneStandard>
        <LaneStandard>
          <Name>ABI-LIZ350</Name>
          <DisplayName>75-350</DisplayName>
          <Characteristics>75 100 139 150 160 200 250 300 340 350</Characteristics>
          <RelativeHeights>MH MH MH MH MH MH MH MH MH MH</RelativeHeights>
          <CorrelationAcceptanceThreshold>0.993</CorrelationAcceptanceThreshold>
          <CorrelationAutoAcceptanceThreshold>0.9975</CorrelationAutoAcceptanceThreshold>
        </LaneStandard>
      </SubFamily>
      <SubFamily>
        <SubFamilyName>ABI-LIZ-500-MID-OMIT</SubFamilyName>
        <LaneStandard>
          <Name>ABI-LIZ-LESS250-500</Name>
          <DisplayName>75-500 OMIT 250</DisplayName>
          <Characteristics>75 100 139 150 160 200 300 340 350 400 450 490 500</Characteristics>
          <RelativeHeights>MH MH MH MH MH MH MH MH MH MH MH MH MH</RelativeHeights>
          <Omissions>250</Omissions>
          <CorrelationAcceptanceThreshold>0.993</CorrelationAcceptanceThreshold>
          <CorrelationAutoAcceptanceThreshold>0.9975</CorrelationAutoAcceptanceThreshold>
        </LaneStandard>
        <LaneStandard>
          <Name>ABI-LIZ-LESS250-450</Name>
          <DisplayName>75-450 OMIT 250</DisplayName>
          <Characteristics>75 100 139 150 160 200 300 340 350 400 450</Characteristics>
          <RelativeHeights>MH MH MH MH MH MH MH MH MH MH MH</RelativeHeights>
          <Omissions>250</Omissions>
          <CorrelationAcceptanceThreshold>0.993</CorrelationAcceptanceThreshold>
          <CorrelationAutoAcceptanceThreshold>0.9975</CorrelationAutoAcceptanceThreshold>
        </LaneStandard>
        <LaneStandard>
          <Name>ABI-LIZ-LESS250-400</Name>
          <DisplayName>75-400 OMIT 250</DisplayName>
          <Characteristics>75 100 139 150 160 200 300 340 350 400</Characteristics>
          <RelativeHeights>MH MH MH MH MH MH MH MH MH MH</RelativeHeights>
          <Omissions>250</Omissions>
          <CorrelationAcceptanceThreshold>0.993</CorrelationAcceptanceThreshold>
          <CorrelationAutoAcceptanceThreshold>0.9975</CorrelationAutoAcceptanceThreshold>
        </LaneStandard>
        <LaneStandard>
          <Name>ABI-LIZ-LESS250-350</Name>
          <DisplayName>75-350 OMIT 250</DisplayName>
          <Characteristics>75 100 139 150 160 200 300 340 350</Characteristics>
          <RelativeHeights>MH MH MH MH MH MH MH MH MH</RelativeHeights>
          <Omissions>250</Omissions>
          <CorrelationAcceptanceThreshold>0.993</CorrelationAcceptanceThreshold>
          <CorrelationAutoAcceptanceThreshold>0.9975</CorrelationAutoAcceptanceThreshold>
        </LaneStandard>
        <LaneStandard>
          <Name>ABI-LIZ-LESS340-500</Name>
          <DisplayName>75-500 OMIT 340</DisplayName>
          <Characteristics>75 100 139 150 160 200 250 300 350 400 450 490 500</Characteristics>
          <RelativeHeights>MH MH MH MH MH MH MH MH MH MH MH MH MH</RelativeHeights>
          <Omissions>340</Omissions>
          <CorrelationAcceptanceThreshold>0.993</CorrelationAcceptanceThreshold>
          <CorrelationAutoAcceptanceThreshold>0.9975</CorrelationAutoAcceptanceThreshold>
        </LaneStandard>
        <LaneStandard>
          <Name>ABI-LIZ-LESS340-450</Name>
          <DisplayName>75-450 OMIT 340</DisplayName>
          <Characteristics>75 100 139 150 160 200 250 300 350 400 450</Characteristics>
          <RelativeHeights>MH MH MH MH MH MH MH MH MH MH MH</RelativeHeights>
          <Omissions>340</Omissions>
          <CorrelationAcceptanceThreshold>0.993</CorrelationAcceptanceThreshold>
          <CorrelationAutoAcceptanceThreshold>0.9975</CorrelationAutoAcceptanceThreshold>
        </LaneStandard>
        <LaneStandard>
          <Name>ABI-LIZ-LESS340-400</Name>
          <DisplayName>75-400 OMIT 340</DisplayName>
          <Characteristics>75 100 139 150 160 200 250 300 350 400</Characteristics>
          <RelativeHeights>MH MH MH MH MH MH MH MH MH MH</RelativeHeights>
          <Omissions>340</Omissions>
          <CorrelationAcceptanceThreshold>0.993</CorrelationAcceptanceThreshold>
          <CorrelationAutoAcceptanceThreshold>0.9975</CorrelationAutoAcceptanceThreshold>
        </LaneStandard>
        <LaneStandard>
          <Name>ABI-LIZ-LESS250and340-500</Name>
          <DisplayName>75-500 OMIT 250, 340</DisplayName>
          <Characteristics>75 100 139 150 160 200 300 350 400 450 490 500</Characteristics>
          <RelativeHeights>MH MH MH MH MH MH MH MH MH MH MH MH</RelativeHeights>
          <Omissions>250 340</Omissions>
          <CorrelationAcceptanceThreshold>0.993</CorrelationAcceptanceThreshold>
          <CorrelationAutoAcceptanceThreshold>0.9975</CorrelationAutoAcceptanceThreshold>
        </LaneStandard>
        <LaneStandard>
          <Name>ABI-LIZ-LESS250and340-450</Name>
          <DisplayName>75-450 OMIT 250, 340</DisplayName>
          <Characteristics>75 100 139 150 160 200 300 350 400 450</Characteristics>
          <RelativeHeights>MH MH MH MH MH MH MH MH MH MH</RelativeHeights>
          <Omissions>250 340</Omissions>
          <CorrelationAcceptanceThreshold>0.993</CorrelationAcceptanceThreshold>
          <CorrelationAutoAcceptanceThreshold>0.9975</CorrelationAutoAcceptanceThreshold>
        </LaneStandard>
        <LaneStandard>
          <Name>ABI-LIZ-LESS250and340-400</Name>
          <DisplayName>75-400 OMIT 250, 340</DisplayName>